title,url,date,tag,K-E,description,company,publisher,platform
Hades II,https://store.steampowered.com/app/1145350/Hades_II/?snr=1_7_7_7000_150_1,2024년 05월 07일,"액션,RPG,로그라이크,액션 로그라이크,신화",Hades II,수상 경력에 빛나는 로그라이크 던전 크롤러의 매혹적인 속편에서 어둠의 마법을 펼치며 시간의 티탄에게 맞서 지하세계 너머에서 전투를 벌이세요.,Supergiant Games,Supergiant Games,steam
PUBG: BATTLEGROUNDS,https://store.steampowered.com/app/578080/PUBG_BATTLEGROUNDS/?snr=1_7_7_7000_150_1,2017년 12월 21일,"생존,슈팅,배틀 로얄,멀티플레이어,PvP",PUBG: BATTLEGROUNDS,PUBG: BATTLEGROUNDS를 무료로 플레이 하세요. 다양한 전장에서 전략적 위치를 선점하고 무기와 장비를 확보해 최후의 1인이 되기 위한 생존의 사투를 펼칩니다. 친구들과 함께 팀을 만들어 배틀로얄 건플레이 장르의 선구자인 PUBG: BATTLEGROUNDS만이 선사하는 긴장감 넘치는 경험을 위해 도전하세요.,"KRAFTON, Inc.","KRAFTON, Inc.",steam
DJMAX RESPECT V,https://store.steampowered.com/app/960170/DJMAX_RESPECT_V/?snr=1_7_7_7000_150_1,2020년 03월 12일,"리듬,캐주얼,음악,액션,스포츠,애니메이션",DJMAX RESPECT V,최고의 인기 리듬게임 “DJMAX” 드디어 STEAM 출시!! DJMAX 시리즈의 최신작 'DJMAX RESPECT'가 더 발전된 모습으로 스팀에 첫 발을 내딛습니다.,NEOWIZ,NEOWIZ,steam
V Rising,https://store.steampowered.com/app/1604030/V_Rising/?snr=1_7_7_7000_150_1,2024년 05월 08일,"생존,오픈 월드,기지 건설,뱀파이어,크래프팅",V Rising,뱀파이어로서 깨어나 인근 거주지에서 피 사냥을 통해 힘을 회복합니다. 치명적인 뜨거운 햇빛을 피하고 자신만의 성채를 건설하고 끊임없이 변화하는 신비로운 오픈 세계에서 발전합시다. 온라인에서 동맹군을 찾아 생존자의 땅을 정복하세요.,Stunlock Studios,Stunlock Studios,steam
Apex 레전드™,https://store.steampowered.com/app/1172470/Apex/?snr=1_7_7_7000_150_1,2020년 11월 05일,"무료 플레이,배틀 로얄,멀티플레이어,1인칭 슈팅","Apex Legends™,Apex 레전드™","Apex 레전드는 Respawn Entertainment에서 제작한 다양한 수상 경력을 자랑하는 무료 플레이 히어로 슈팅 게임입니다. 게임에 계속해서 추가되는 레전드 캐릭터들의 강력한 능력을 마스터하고 깊이 있는 전술적 분대 플레이, 새롭게 진화하는 게임플레이를 지닌 히어로 슈팅과 배틀 로얄의 혁신을 경험하세요.",Respawn,Electronic Arts,steam
Ghost of Tsushima 디렉터스 컷,https://store.steampowered.com/app/2215430/Ghost_of_Tsushima/?snr=1_7_7_7000_150_1,2024년 05월 17일,"액션,어드벤처,오픈 월드,3인칭,액션 RPG","Ghost of Tsushima DIRECTOR'S CUT,Ghost of Tsushima 디렉터스 컷","폭풍이 몰려옵니다. PC에서 완전한 Ghost of Tsushima 디렉터스 컷의 세계로 모험을 떠나세요. 이 오픈 월드 액션 어드벤처 게임에서 나만의 길을 개척하고 숨겨진 경이를 발견하세요. Sucker Punch Productions, Nixxes Software 및 PlayStation Studios가 제공합니다.",Sucker Punch Productions,PlayStation PC LLC,steam
이터널 리턴,https://store.steampowered.com/app/1049590/_/?snr=1_7_7_7000_150_1,2023년 07월 20일,"무료 플레이,애니메이션,MOBA,멀티플레이어","Eternal Return,이터널 리턴","이터널 리턴은 쿼터뷰 스타일의 무료 배틀로얄 게임입니다. 제작, 사냥, 전투 그리고 멋진 캐릭터들을 경험해보시고 생존을 위한 전략적인 판단, 화려한 전투 플레이로 영원히 반복되는 실험에서 최후의 생존자가 되십시오.",Nimble Neuron,"Kakao Games Europe B.V. (EU,NA,OCE)",steam
ELDEN RING,https://store.steampowered.com/app/1245620/ELDEN_RING/?snr=1_7_7_7000_150_1,2022년 02월 25일,"소울라이크,다크 판타지,오픈 월드,RPG,액션",ELDEN RING,"본 게임은 본격적인 다크 판타지 세계를 무대로 한 액션 RPG입니다. 드넓은 필드와 던전 탐험을 통해 미지의 것들을 발견해 보세요. 앞길을 막아서는 난관과 그것을 극복했을 때의 달성감, 그리고 등장인물들의 의도가 교착하는 군상극도 즐기실 수 있습니다.",FromSoftware Inc.,FromSoftware Inc.,steam
Limbus Company,https://store.steampowered.com/app/1973530/Limbus_Company/?snr=1_7_7_7000_150_1,2023년 02월 27일,"깊은 세계관,풍부한 스토리,RPG,턴제 전술",Limbus Company,"림버스 컴퍼니의 관리자가 되어 12명의 수감자를 이끌고, 폐쇄된 로보토미 코퍼레이션 지부로 들어가 황금가지를 탈환하세요.",ProjectMoon,ProjectMoon,steam
Yu-Gi-Oh! Master Duel,https://store.steampowered.com/app/1449850/YuGiOh_Master_Duel/?snr=1_7_7_7000_150_1,2022년 01월 19일,"카드 게임,무료 플레이,전략,트레이딩 카드 게임",Yu-Gi-Oh! Master Duel,사상 최고봉의 디지털 카드 게임으로!,KONAMI,KONAMI,steam
Counter-Strike 2,https://store.steampowered.com/app/730/CounterStrike_2/?snr=1_7_7_7000_150_1,2012년 08월 22일,"1인칭 슈팅,슈팅,멀티플레이어,경쟁,액션",Counter-Strike 2,Counter-Strike는 20년이 넘는 시간 동안 전 세계 수백만 명의 플레이어가 모여 수준 높은 경쟁을 펼칠 수 있는 플랫폼을 제공해 왔습니다. 그리고 이제 곧 Counter-Strike 2와 함께 새로운 CS 시대의 막이 열립니다.,Valve,Valve,steam
Hades,https://store.steampowered.com/app/1145360/Hades/?snr=1_7_7_7000_150_1,2020년 09월 17일,"액션 로그라이크,로그라이트,핵 앤 슬래시,인디",Hades,"Bastion, Transistor, Pyre의 제작사에서 선보이는 이 로그라이크 던전 탐색형 게임에서 핵 앤 슬래시로 지하 세계를 탈출하고 죽음의 신에게 도전하세요.",Supergiant Games,Supergiant Games,steam
Homeworld 3,https://store.steampowered.com/app/1840080/Homeworld_3/?snr=1_7_7_7000_150_1,2024년 05월 14일,"우주,실시간 전략,전략,풍부한 스토리,전술",Homeworld 3,"전략적이고, 아름답고, 아주 독특하며, 여러 GOTY를 수상한 SF RTS가 Homeworld 3로 돌아옵니다. 많은 상을 받은 은하계 규모의 스토리가 펼쳐지는 동안, 완전한 3D로 구현된 눈부신 우주에서 함대를 통솔해 적 함대를 격파하십시오.",Blackbird Interactive,Gearbox Publishing,steam
Grand Theft Auto V,https://store.steampowered.com/app/271590/Grand_Theft_Auto_V/?snr=1_7_7_7000_150_1,2015년 04월 14일,"오픈 월드,액션,멀티플레이어,범죄,3인칭",Grand Theft Auto V,"PC용 Grand Theft Auto V는 각종 수상에 빛나는 로스 산토스와 블레인 카운티의 거대한 세상을 최대 4K 이상의 해상도로 둘러볼 수 있는 기회를 플레이어에게 제공하며, 초당 60프레임으로 게임을 실행할 수도 있습니다.",Rockstar North,Rockstar Games,steam
HELLDIVERS™ 2,https://store.steampowered.com/app/553850/HELLDIVERS_2/?snr=1_7_7_7000_150_1,2024년 02월 08일,"온라인 협동,3인칭 슈팅,멀티플레이어,액션",HELLDIVERS™ 2,"은하계 최고의 공격 부대. 빠르고, 정신없고, 격렬한 3인칭 슈팅 게임에서 헬다이버가 되어 적대적인 은하계 전역을 누비며 자유를 위해 싸우세요.",Arrowhead Game Studios,PlayStation PC LLC,steam
Crusader Kings III,https://store.steampowered.com/app/1158310/Crusader_Kings_III/?snr=1_7_7_7000_150_1,2020년 09월 02일,"전략,시뮬레이션,중세,대전략,RPG,역사",Crusader Kings III,"사랑하고, 싸우고, 계략을 세우고, 위대함을 쟁취하세요. Crusader Kings III의 마구 뻗어 나가는 대전략 게임에서 귀족 가문의 유산을 결정하세요. 풍부하고 개성 넘치는 중세 시대 시뮬레이션 속 왕조 혈통을 이어나가는 이곳에서, 죽음은 단지 시작일 뿐입니다.",Paradox Development Studio,Paradox Interactive,steam
DARK SOULS™ III,https://store.steampowered.com/app/374320/DARK_SOULS_III/?snr=1_7_7_7000_150_1,2016년 04월 12일,"소울라이크,다크 판타지,고난이도,RPG,3인칭",DARK SOULS™ III,"장르를 새로 개척했다는 평가를 들으며 많은 좋은 평가들을 얻고 있는 다크 소울 시리즈는 계속해서 한계를 넘어서, 더욱 야심찬 단계에 도전하고자 하고 있습니다. 준비를 하고 어둠을 밝히십시오!","FromSoftware, Inc.","FromSoftware, Inc.",steam
Baldur's Gate 3,https://store.steampowered.com/app/1086940/Baldurs_Gate_3/?snr=1_7_7_7000_150_1,2023년 08월 04일,"RPG,선택의 중요성,캐릭터 커스터마이즈,CRPG",Baldur's Gate 3,"Baldur’s Gate 3 is a story-rich, party-based RPG set in the universe of Dungeons & Dragons, where your choices shape a tale of fellowship and betrayal, survival and sacrifice, and the lure of absolute power.",Larian Studios,Larian Studios,steam
Stellaris,https://store.steampowered.com/app/281990/Stellaris/?snr=1_7_7_7000_150_1,2016년 05월 10일,"우주,대전략,전략,공상과학,4X,탐험",Stellaris,"항성간 여행을 통해 우주를 탐험하며 수많은 종족들도 만나보세요. 과학선을 보내 우주를 조사하고 탐험하면서 은하 제국을 건설하고, 건축선을 보내 새로 발견한 행성에 기지를 건설하세요. 소속 사회를 위한 탐험에 나서 매장된 보물과 은하계의 경이를 발견하고, 탐험가의 한계치와 진화 범위를 설정하세요. 동맹이 체결되고, 전쟁이 선포됩니다.",Paradox Development Studio,Paradox Interactive,steam
eFootball™ 2024,https://store.steampowered.com/app/1665460/eFootball_2024/?snr=1_7_7_7000_150_1,2021년 09월 30일,"축구,무료 플레이,스포츠,멀티플레이어,PvP",eFootball™ 2024,언제라도 최신 데이터로 즐길 수 있는 액션 축구 게임의 대표작! 뜨거운 열기가 소용돌이치는 ‘리얼 사커’를 eFootball™ 2024에서 즐겨 보십시오!,KONAMI,KONAMI,steam
Dying Light,https://store.steampowered.com/app/239140/Dying_Light/?snr=1_7_7_7000_150_1,2016년 04월 22일,"좀비,생존 공포,공포,온라인 협동,오픈 월드",Dying Light,"종말 이후 굶주린 좀비가 넘쳐나는 오픈 월드를 배경으로 펼쳐지는 1인칭 액션 생존 게임을 즐겨보세요. 여러분은 수수께끼의 바이러스 전염에 의해 몰락한 도시를 탐험하며 물자를 찾고, 무기를 제작하여 감염된 생명체 무리들을 상대해야 합니다.",Techland,Techland,steam
크로노 아크,https://store.steampowered.com/app/1188930/_/?snr=1_7_7_7000_150_1,2024년 05월 03일,"로그라이크 덱빌딩,RPG,애니메이션,전략","Chrono Ark,크로노 아크","크로노 아크는 파티 기반 RPG, 덱 빌딩, 로그라이크 요소를 혼합하여 만들어진 싱글 플레이 게임입니다.특색 있는 능력을 가진 동료를 영입하고 다양한 스킬을 배워 최고의 파티를 만들고 뒤틀린 세계를 구하세요!",Al Fine,Al Fine,steam
Palworld / 팰월드,https://store.steampowered.com/app/1623730/Palworld/?snr=1_7_7_7000_150_1,2024년 01월 19일,"멀티플레이어,오픈 월드,생명체 수집,생존,3D","Palworld,Palworld / 팰월드","드넓은 세계에 서식하는 신비한 생물 ""팰""을 수집하여 전투, 건축, 농업에 투입하거나 공장에서 일을 시키는 등, 전에 없던 새로운 체험을 선사하는 멀티 지원 오픈월드 서바이벌 크래프트 게임입니다.",Pocketpair,Pocketpair,steam
Company of Heroes 3,https://store.steampowered.com/app/1677280/Company_of_Heroes_3/?snr=1_7_7_7000_150_1,2023년 02월 24일,"전략,전쟁 게임,실시간 전략,액션 RTS,PvP",Company of Heroes 3,"사상 최대의 야심작으로 돌아온 Company of Heroes 3에서는 눈부신 지중해 전구를 배경으로 한 가슴 뛰는 전투와 심도 있는 전략적 선택이 갖춰져 있습니다. Company of Heroes 3의 전투에는 모두 이야기가 깃들어 있습니다... 여러분의 이야기는 무엇입니까?""",Relic Entertainment,SEGA,steam
EA SPORTS FC™ 24,https://store.steampowered.com/app/2195250/EA_SPORTS_FC_24/?snr=1_7_7_7000_150_1,2023년 09월 29일,"축구,스포츠,컨트롤러,멀티플레이어,PvP",EA SPORTS FC™ 24,"EA SPORTS FC™ 24가 The World’s Game에 여러분을 초대합니다. HyperMotionV, Opta에 의해 최적화된 플레이스타일, 향상된 Frostbite™ 엔진을 통해 사상 최고로 현실감 넘치는 축구 경험을 제공합니다.",EA Canada & EA Romania,Electronic Arts,steam
데스티니 가디언즈,https://store.steampowered.com/app/1085660/_/?snr=1_7_7_7000_150_1,2019년 10월 02일,"무료 플레이,오픈 월드,1인칭 슈팅,MMORPG","Destiny 2,데스티니 가디언즈",데스티니 가디언즈는 끝없이 진화하는 하나의 세계에서 플레이하는 액션 MMO입니다. 언제 어디서든 친구들과 함께 무료로 플레이하세요.,Bungie,Bungie,steam
GrandChase,https://store.steampowered.com/app/985810/GrandChase/?snr=1_7_7_7000_150_1,2021년 07월 28일,"액션,PvE,PvP,무료 플레이,액션 RPG",GrandChase,‘그랜드체이스’는 애니메이션풍의 비쥬얼을 가진 횡스크롤 온라인 액션 RPG 게임으로 기본 무료 입니다. 개성 있는 캐릭터들로 던전과 대전에서 시원한 액션을 즐겨 보세요.,KOG,KOG,steam
DARK SOULS III Deluxe Edition,https://store.steampowered.com/sub/94174/?snr=1_7_7_7000_150_1,2016년 04월 12일,"캐주얼,선정적인 내용,애니메이션,심리적 공포","RiichiCity - ACG mahjong games,麻雀一番街","Riichi City is a competitive urban-style Anime mahjong game, featuring beginner-friendly mahjong tutorials, Ranked Matches and tournaments crowded with masters! Spice up the experience with our ACG characters voiced by famous CVs, and attractive items and decorations! Set off for Riichi City now!","Formirai Co., Ltd.","Formirai Co., Ltd.",steam
麻雀一番街,https://store.steampowered.com/app/1954420/_/?snr=1_7_7_7000_150_1,2022년 09월 08일,"시뮬레이션,스포츠,전략,축구,경영,경제",Football Manager 2024,축구의 정점을 향하여 절대 멈추지 말고 발전하세요. 시리즈 사상 가장 완벽한 작품에서 새롭게 추가된 기능들로 승리를 향한 청사진을 설계하세요. 지금 사전 구매하고 10% 할인 및 사전 액세스 혜택을 받으세요*.,Sports Interactive,SEGA,steam
Football Manager 2024,https://store.steampowered.com/app/2252570/Football_Manager_2024/?snr=1_7_7_7000_150_1,2023년 11월 07일,"전략,제2차 세계 대전,대전략,전쟁,역사",Hearts of Iron IV,"Victory is at your fingertips! Your ability to lead your nation is your supreme weapon, the strategy game Hearts of Iron IV lets you take command of any nation in World War II; the most engaging conflict in world history.",Paradox Development Studio,Paradox Interactive,steam
Hearts of Iron IV,https://store.steampowered.com/app/394360/Hearts_of_Iron_IV/?snr=1_7_7_7000_150_1,2024년 04월 10일,"개척 시뮬레이션,기지 건설,생존,전략,경영",RimWorld,"지능형 AI 이야기꾼이 주도하는 공상과학 정착지 시뮬레이터입니다. 심리, 생태, 총격전과 근접전, 날씨, 기후, 외교, 사람 사이의 관계, 예술, 의학, 무역, 그 외 많은 것들을 시뮬레이션하여 이야기를 생성합니다.",Ludeon Studios,Ludeon Studios,steam
RimWorld,https://store.steampowered.com/app/294100/RimWorld/?snr=1_7_7_7000_150_1,2018년 10월 17일,"온라인 협동,공포,1인칭,협동,생존 공포",Lethal Company,A co-op horror about scavenging at abandoned moons to sell scrap to the Company.,Zeekerss,Zeekerss,steam
Lethal Company,https://store.steampowered.com/app/1966720/Lethal_Company/?snr=1_7_7_7000_150_1,2023년 10월 24일,"무료 플레이,액션 RPG,약탈 슈팅,3인칭 슈팅",Warframe,"이 스토리 중심의 부분 유료 온라인 액션 게임에서 그 누구도 멈출 수 없는 강력한 전사로 깨어나 동료들과 함께 싸움에 임하세요. 여러 행성에 걸쳐 뻗어나가는 성계 이곳저곳에서 전쟁을 벌이는 세력들과 맞서며, 신비로운 인물, 로터스의 안내에 따르며 워프레임을 레벨업하고, 파괴적인 화력을 가진 무기고를 쌓아올리고, 이 짜릿한, 전혀 새로운 장르의 3인칭 전투 경험 속의 거대한 오픈 월드에서 여러분의 진짜 잠재력을 불러일으키세요.",Digital Extremes,Digital Extremes,steam
Warframe,https://store.steampowered.com/app/230410/Warframe/?snr=1_7_7_7000_150_1,2013년 03월 26일,"농장 시뮬레이션,픽셀 그래픽,생활 시뮬레이션",Stardew Valley,"You've inherited your grandfather's old farm plot in Stardew Valley. Armed with hand-me-down tools and a few coins, you set out to begin your new life. Can you learn to live off the land and turn these overgrown fields into a thriving home?",ConcernedApe,ConcernedApe,steam
Stardew Valley,https://store.steampowered.com/app/413150/Stardew_Valley/?snr=1_7_7_7000_150_1,2016년 02월 27일,"어드벤처,3D 플랫폼,싱글 플레이어,3인칭",Ratchet & Clank: Rift Apart,"라쳇, 클랭크와 함께 여러 차원을 넘나들면서 박진감 넘치는 모험을 즐겨보세요. PC로 출시되었습니다! 하이퍼 스피드의 액션이 난무하는 갖가지 세상 너머로 뛰어들어 다른 현실에서 온 사악한 황제를 상대하세요!",Insomniac Games,PlayStation PC LLC,steam
Ratchet & Clank: Rift Apart,https://store.steampowered.com/app/1895880/Ratchet__Clank_Rift_Apart/?snr=1_7_7_7000_150_1,2023년 07월 26일,"전략,턴제 전략,대전략,실시간 전략,판타지",Total War: WARHAMMER III,Total War: WARHAMMER 3부작의 격렬한 결말이 도래했습니다. 병력을 결집하여 혼돈의 영역에 발들이십시오. 정신을 농락하는 이 공포의 공간에서 세상의 운명이 결정될 것입니다. 자신의 악마를 정복하시겠습니까… 아니면 뜻대로 부리시겠습니까?,CREATIVE ASSEMBLY,SEGA,steam
Total War: WARHAMMER III,https://store.steampowered.com/app/1142710/Total_War_WARHAMMER_III/?snr=1_7_7_7000_150_1,2022년 02월 17일,"생활 시뮬레이션,캐릭터 커스터마이즈,건설,유머",The Sims™ 4,아무런 제약 없는 가상 세계에서 심들을 창조하고 지배하는 전능한 힘을 즐기세요. 강력한 권력을 휘두르며 자유롭고 재미있게 인생을 플레이하세요!,Maxis,Electronic Arts,steam
The Sims™ 4,https://store.steampowered.com/app/1222670/The_Sims_4/?snr=1_7_7_7000_150_1,2020년 06월 19일,"사이버펑크,오픈 월드,누드,RPG,공상과학",Cyberpunk 2077,"사이버펑크 2077은 권력과 돈, 끝없는 신체 개조에 집착하는 어두운 미래의 위험천만한 메갈로폴리스, '나이트 시티'를 배경으로 한 오픈 월드 액션 어드벤처 RPG입니다.",CD PROJEKT RED,CD PROJEKT RED,steam
Cyberpunk 2077,https://store.steampowered.com/app/1091500/Cyberpunk_2077/?snr=1_7_7_7000_150_1,2020년 12월 10일,"액션 RPG,핵 앤 슬래시,RPG,아이소메트릭","Diablo® IV,디아블로® IV","궁극의 액션 RPG 모험, 디아블로® IV에서 성역을 위한 전투에 참여하십시오. 높은 평가를 받은 캠페인과 신규 시즌 콘텐츠를 경험하십시오.","Blizzard Entertainment, Inc.","Blizzard Entertainment, Inc.",steam
디아블로® IV,https://store.steampowered.com/app/2344520/_IV/?snr=1_7_7_7000_150_1,2023년 10월 18일,"전략,4X,캐릭터 커스터마이즈,선택의 중요성",Age of Wonders 4,나만의 판타지 세계를 지배하라! 4X 전략과 턴제 전술 전투를 합친 Age of Wonders의 시스템과 함께 새 마법 세계를 탐험하세요. 턴을 진행하는 동안 제국을 확장하며 자신의 세력을 양성하고 변모시켜야 합니다!,Triumph Studios,Paradox Interactive,steam
Age of Wonders 4,https://store.steampowered.com/app/1669000/Age_of_Wonders_4/?snr=1_7_7_7000_150_1,2023년 05월 03일,"멀티플레이어,온라인 협동,로컬 협동,협동",Overcooked! 2,혼란스러운 요리 액션으로 가득한 Overcooked가 돌아왔습니다! 양파 왕국으로 돌아가는 여행을 떠나세요. 클래식 협동 또는 온라인 플레이에서 셰프 팀을 만들어서 최대 4명까지 플레이하세요. 앞치마를 준비하세요... 다시 세상을 구할 때가 되었습니다!,Ghost Town Games Ltd.,Team17,steam
Overcooked! 2,https://store.steampowered.com/app/728880/Overcooked_2/?snr=1_7_7_7000_150_1,2018년 08월 08일,"PvP,중세,MMO,액션,전략,MMORPG","Conqueror's Blade,컨커러스 블레이드",컨커러스 블레이드에서는 누구든지 위대한 장군이 될 수 있습니다. 부대를 이끌고 전 세계 장군님들과 함께 15 대 15공성전에 참여해 성과 영토를 정복하세요. 장군님의 명성을 지금 바로 전 세계에 알리세요!,Booming Tech,Poros Interactive,steam
컨커러스 블레이드,https://store.steampowered.com/app/835570/_/?snr=1_7_7_7000_150_1,2020년 04월 06일,"탐험,메트로배니아,퍼즐,퍼즐 플랫폼,플랫폼",ANIMAL WELL,"어두컴컴하고, 복잡하게 얽혀있는 미로를 탐험하며 미로 안의 숨겨진 비밀들을 밝혀내세요. 아이템을 수집해 주변 환경을 놀랍고 의미있는 방식으로 활용하세요. 어둠속에 숨어있는 위험으로부터 살아남기 위해 애쓰다보면, 귀엽지만, 마음의 동요를 불러일으키는 생물들도 만나게 됩니다. 눈 앞에 보이는것만 전부가 아닙니다.",Billy Basso,Bigmode,steam
ANIMAL WELL,https://store.steampowered.com/app/813230/ANIMAL_WELL/?snr=1_7_7_7000_150_1,2024년 05월 09일,"소울라이크,다크 판타지,RPG,고난이도,액션",DARK SOULS™: REMASTERED,기억하시나요? 불이 있었습니다. 굉장한 호평을 받으며 장르를 재정립한 게임의 모든 것을 다시 경험해보세요. 아름답게 리마스터되어 60fps로 돌아가는 고해상도로 그려진 로드란으로 돌아가세요. 다크 소울 리마스터에는 본편과 심연의 아르토리우스 DLC가 포함됩니다.,QLOC,"FromSoftware, Inc",steam
DARK SOULS™: REMASTERED,https://store.steampowered.com/app/570940/DARK_SOULS_REMASTERED/?snr=1_7_7_7000_150_1,2018년 05월 24일,"무료 플레이,MOBA,멀티플레이어,전략,경쟁",Dota 2,"매일, 전 세계 수백 만의 플레이어가 백여 명의 도타 영웅 중 하나가 되어 전장에 뛰어듭니다. 10시간을 했든, 1,000시간을 했든 언제나 새롭게 느껴지는 무언가가 있습니다. 정기적인 업데이트로 게임플레이, 기능, 영웅이 끊임없이 진화하는 도타 2는 그 자체의 생명력으로 살아 숨 쉬는 게임입니다.",Valve,Valve,steam
Dota 2,https://store.steampowered.com/app/570/Dota_2/?snr=1_7_7_7000_150_1,2013년 07월 10일,"협동,멀티플레이어,분할 화면,로컬 협동,퍼즐",It Takes Two,"It Takes Two에서 생애 가장 정신없는 여정을 시작하세요. 친구가 무료로 참가할 수 있게 친구 패스*로 초대하고, 함께 힘을 합쳐서 수많은 유쾌하고 획기적인 게임 플레이 챌린지를 헤쳐나가세요.",Hazelight,Electronic Arts,steam
It Takes Two,https://store.steampowered.com/app/1426210/It_Takes_Two/?snr=1_7_7_7000_150_1,2021년 03월 26일,"생존,좀비,오픈 월드,오픈 월드 생존 제작,2D",Project Zomboid,"Project Zomboid is the ultimate in zombie survival. Alone or in MP: you loot, build, craft, fight, farm and fish in a struggle to survive. A hardcore RPG skillset, a vast map, massively customisable sandbox and a cute tutorial raccoon await the unwary. So how will you die? All it takes is a bite..",The Indie Stone,The Indie Stone,steam
Project Zomboid,https://store.steampowered.com/app/108600/Project_Zomboid/?snr=1_7_7_7000_150_1,2013년 11월 09일,"전략,도시 건설,시뮬레이션,기지 건설,경영","Manor Lords,Manor Lords 매너 로드","Manor Lords는 정밀한 도시 건설, 전술이 필요한 대규모 전투, 정교한 경제 및 사회 시뮬레이션을 특징으로 하는 중세 전략 게임입니다. 시간에 따라 계절이 지나고 날씨가 다채롭게 변화하며 도시가 흥망성쇠를 겪는 가운데 중세 영주가 되어 자신의 영토를 통치해 보세요.",Slavic Magic,Hooded Horse,steam
Manor Lords 매너 로드,https://store.steampowered.com/app/1363080/Manor_Lords/?snr=1_7_7_7000_150_1,2024년 04월 26일,"PvP,멀티플레이어,유머,협동,파티 게임,밈",Super Bunny Man,"토끼 코스튬을 입은 사람이 나오는 물리 엔진 기반 협동 플랫폼 게임! 친구 한 명 혹은 세 명(로컬 혹은 온라인)과 협력해 레벨을 깨고, 숨겨진 당근을 찾고, 시간과의 싸움을 하세요. 토끼의 광기를 체험해 보세요. 당근의 혼돈을 받아들이세요. Super Bunny Man이 되세요.",Catobyte,Catobyte Ltd,steam
Super Bunny Man,https://store.steampowered.com/app/673750/Super_Bunny_Man/?snr=1_7_7_7000_150_1,2023년 05월 17일,"무료 플레이,차량 전투,전투,제2차 세계 대전",War Thunder,"War Thunder는 제 2차 세계대전부터 현대전까지의 항공기, 전차, 함선, 헬리콥터를 플레이 할 수 있는 온라인 게임 역사상 가장 거대한 스케일과 광범위한 크로스 플랫폼 기능을 자랑하는 밀리터리 MMO 게임입니다. 지금 게임에 참여하셔서 War Thunder가 제공하는 지상, 공중, 해상의 거대한 전장 서사시에 직접 참여해보세요.",Gaijin Entertainment,Gaijin Network Ltd,steam
