title,url,thumb,releaseDate,description,company,tag,platform
뱀파이어: 마스커레이드 - 스완송 (Vampire: The Masquerade - Swansong),https://store.nintendo.co.kr/70010000053793,https://store.nintendo.co.kr/media/catalog/product/cache/8e9715bba90fc562158bff7d4731afc3/f/i/file_46_1.jpg,2019/7/26,"세 개의 나라, 세 개의 반, 그리고 당신의 이야기

제국, 왕국, 동맹의 3대국이 차지하고 있는 포드라의 대지. 그 중앙에 위치하는 사관학교에는 마치 포드라의 축소판 같이, 3개국의 차기 지휘자들이 반장을 맡고 있는 3개의 반이 있었습니다.

본 작품은 사관학교에 모이는 개성 넘치는 학생들의 담임이 되어 수업에서 교사로서 그들을 교육하고 전장에 있어서는 지휘관으로서 승리로 이끄는 롤플레잉 시뮬레이션입니다.

격동의 시대를 살아가는 젊은이들의 성장과 함께, 포드라 전체를 둘러싼 전란의 계기부터 결말까지를 2부 구성의 스토리로 그려 갑니다. 제 1부에서 어느 반의 담임을 할지 선택함에 따라 제 2부의 스토리는 3가지로 갈라집니다. 당신의 선택으로 3가지의 다른 미래가 그려집니다.",✕ 1 ~ 1,"RPG,시뮬레이션",nintendo
파이어 엠블렘 풍화설월,https://store.nintendo.co.kr/70010000021361,https://store.nintendo.co.kr/media/catalog/product/cache/8e9715bba90fc562158bff7d4731afc3/f/4/f448de04544b78316e4de639cd554d417559def0946b7965e1bee9823f939304.jpg,2023/1/20,"「파이어 엠블렘」시리즈 최신작의 무대는 4개의 왕국과 1개의 성지로 이루어진 세계 「엘레오스 대륙」.

천 년 전, 사람과 사룡 사이에 전쟁이 일어나며, 사람들은 이계의 영웅 「문장사」의 도움을 받으며 각국의 전사들과 힘을 합쳐 기나긴 싸움 끝에 사룡을 봉인했습니다.
하지만 시간이 지날수록 봉인의 힘은 약해져 갔고, 사룡 부활의 전조가 보이기 시작했습니다…

본작의 주인공은 신룡. 천 년 전, 사룡을 봉인한 이후 잠들었지만, 어느날 갑자기 깨어났습니다. 오랜 시간 잠들어 있던 탓인지, 자신이 누구인지 기억하지 못하는 것 같습니다. 이야기는 대대로 신룡을 지켜 온 「용의 수호자」들과의 만남으로부터 시작됩니다.

파이어 엠블렘 시리즈의 특징 중 하나는 칸으로 구분된 전장에서 펼쳐지는 전략성 높은 배틀이며, 주인공은 반지에 잠들어 있는 이계의 영웅 「문장사」를 불러낼 수 있습니다.

캐릭터들이 반지를 끼고, 문장사의 힘을 빌리면 스테이터스가 상승해서, 보다 강력한 능력 등을 사용할 수 있게 됩니다. 또한, 문장사와 캐릭터가 「인게이지」(합체)하면, 강력한 필살기를 구사할 수 있습니다.

새로운 세계 「엘레오스 대륙」에서 신룡 및 다양한 인물들과의 이야기가 펼쳐집니다.",✕ 1 ~ 1,RPG,nintendo
파이어 엠블렘 Engage,https://store.nintendo.co.kr/70010000058804,https://store.nintendo.co.kr/media/catalog/product/cache/8e9715bba90fc562158bff7d4731afc3/h/q/hqdefault_11_1.jpg,2022/6/24,"『파이어 엠블렘 풍화설월』의 세계를 계승하여, 무쌍 시리즈 특유의 액션과 함께 장대한 이야기

세 개의 세력이 통치하는 대지, 포드라를 무대로 서로의 정의가 뒤얽히는 싸움을 그려낸 『파이어 엠블렘 풍화설월』.

그 세계와 캐릭터를 계승하고 있는 본작에서는 바로 그 포드라 대지에서 있었을지도 모를 새로운 이야기를 그려냅니다.

● 새로운 만남으로부터 생겨나는, 또 하나의 포드라 전투
『파이어 엠블렘 풍화설월』의 주인공을 대신하여, 세 세력의 젊은 차기 지도자들과의 재회를 이뤄낸 것은 본작의 주인공이자 새로운 캐릭터 「세즈」.
원작과는 다른 만남으로부터 시작되는 이 이야기는, 당신의 선택에 의해, 서로 맞물리지 않는 세 개의 길로 나뉘어 진행됩니다.

수수께끼에 싸여 있는 인물 「아르발」의 존재.
그리고, 세즈 앞을 막아서는 원작의 주인공 「회색 악마」.
아직 보지 못 한 역사의 끝에서 기다리고 있는 것은 희망일까, 절망일까…

● 세 가지 파트의 사이클로 진행되는 이야기
<군비 파트>
전초 기지 안을 자유롭게 이동하거나, 동료와 교류하고 아군을 강화하는 파트.
다음 전투를 위해 주인공 자신과 동료를 육성하는 한편, 다양한 활동을 함께 하거나, 유대감을 쌓는 대화를 즐길 수도 있습니다.

<진군 파트>
메인 퀘스트가 발생한 지점까지, 맵을 통해 상황을 확인하며 진군합니다. 귀중품을 판매하는 「행상인 안나」, 보수를 얻을 수 있는 「조사 지점」, 기간 한정의 「엑스트라 퀘스트」 등, 다양한 이벤트가 발생하기도 합니다.

<전투 파트>
실시간으로 전황이 변화하는 전장에서, 차분히 생각하여 동료에게 지시를 내리는 시뮬레이션다운 즐거움은 물론, 직접 캐릭터를 조작하며 길을 개척하는 쾌감 넘치는 무쌍 액션과 함께 「파이어 엠블렘 무쌍」 시리즈만의 전투를 즐길 수 있습니다.
또한, 적의 공격으로부터 지켜주거나, 연계해서 큰 기술을 펼치는 「부관」, 거대한 강적 「마수」 등, 『파이어 엠블렘 풍화설월』다운 요소들도 가득합니다.

● 「캐릭터×병과」로 자유로운 육성
「병과」를 변경하면 액션과 적군에 대해 유리・불리한 상성이 변화합니다. 각 캐릭터 고유의 특징과 조합하여, 자유로운 캐릭터 육성을 즐길 수 있습니다.

※한국어, 영어, 프랑스어, 독일어, 이탈리아어, 스페인어, 일본어, 중국어(간자체), 중국어(번자체) 자막을 지원하며, 영어 음성과 일본어 음성을 수록하여 원하는 음성으로 이야기를 즐길 수 있습니다.",✕ 1 ~ 2,"액션,RPG,어드벤처,전략",nintendo
